{
  "schemaId": "gibson.policy.manifest.schema.v1",
  "schemaVersion": "1.0.0",
  "manifestId": "gibson.core.policy",
  "manifestVersion": "1.0.0",
  "status": "candidate",
  "authority": "report-only",
  "activated": false,
  "generatorVersion": "1.0.0",
  "validatorVersion": "1.0.0",
  "compatibility": {
    "policy": "semver-major-break",
    "forkExtensionRule": "namespaced-only",
    "coreIdPrefix": "gibson.",
    "upgrade": "Bump manifestVersion for additive clarifications within major 1. A new schema major requires a new schemaId/version pair and a migration note; validators must refuse unsupported majors.",
    "rollback": "Revert to the previous candidate file and validatorVersion pin. Because this slice is report-only and not activated, rollback restores representation only — runtime gates are unchanged.",
    "notes": "Forks extend with namespaced IDs under allowedNamespaces only. Core gibson.* IDs may not be shadowed. Precedence conflicts refuse closed. Generated doctrine views and activation remain #164."
  },
  "provenance": {
    "sources": [
      {
        "id": "src.agents-contract",
        "path": "AGENTS.md",
        "digestAlgorithm": "sha256",
        "digest": "689c170eef96a5dbaf15ad8f27ced0c07f29ebcb71c7fc1f38382154748f8772",
        "role": "human-readable-contract"
      },
      {
        "id": "src.human-gates",
        "path": "docs/14-human-gates.md",
        "digestAlgorithm": "sha256",
        "digest": "2a775da934bec92d85658402d772d2adedc6f25bcc35e2507503f85efa8c5cc9",
        "role": "explanatory-history"
      },
      {
        "id": "src.quality-gates",
        "path": "docs/06-quality-gates.md",
        "digestAlgorithm": "sha256",
        "digest": "7c8505ff68c7a1dacc4eaed1d40e16baf0c20b00062d7024b7c22ad668365013",
        "role": "explanatory-history"
      },
      {
        "id": "src.roles",
        "path": "docs/03-roles.md",
        "digestAlgorithm": "sha256",
        "digest": "126c0f616e598d950366cbfadaca40d2aaa857bcfade56bc19e132fe32ffc8dc",
        "role": "explanatory-history"
      },
      {
        "id": "src.sdlc-pipeline",
        "path": "docs/02-sdlc-pipeline.md",
        "digestAlgorithm": "sha256",
        "digest": "c876a38d895e4408a72cdef6aee4a8e9c2e233d7239df09cde6679c47a4a000a",
        "role": "explanatory-history"
      },
      {
        "id": "src.fork-upstream",
        "path": "docs/18-fork-and-upstream.md",
        "digestAlgorithm": "sha256",
        "digest": "6003123b35d2cf785509608c98ad06c2be9c307d9219b4cb639d3f6c0ffd3425",
        "role": "explanatory-history"
      }
    ]
  },
  "humanGates": [
    {
      "id": "G1",
      "category": "destructive",
      "summary": "Schema-destructive change, non-additive migration, or manual write against a production database.",
      "severity": false
    },
    {
      "id": "G2",
      "category": "destructive",
      "summary": "Deleting user data, emptying buckets, removing deployments/envs/domains.",
      "severity": false
    },
    {
      "id": "G3",
      "category": "destructive",
      "summary": "Force-push to a shared branch; history rewrite.",
      "severity": false
    },
    {
      "id": "G4",
      "category": "destructive",
      "summary": "Secret rotation and any confirmed secret leak response.",
      "severity": false
    },
    {
      "id": "G5",
      "category": "money",
      "summary": "Any spend: new paid services, plan changes, domain purchases, paid API keys.",
      "severity": false
    },
    {
      "id": "G6",
      "category": "money",
      "summary": "Merge gate on billing/pricing/payment code (Tier C).",
      "severity": false,
      "relatedTierIds": [
        "C"
      ]
    },
    {
      "id": "G7",
      "category": "outward-facing",
      "summary": "Production launches of user-visible surfaces (first public exposure).",
      "severity": false
    },
    {
      "id": "G8",
      "category": "outward-facing",
      "summary": "Sending anything to humans: email, SMS, social, newsletter, publishing packages, public repos.",
      "severity": false
    },
    {
      "id": "G9",
      "category": "outward-facing",
      "summary": "Anything using the owner identity or accounts beyond repo/CI scope.",
      "severity": false
    },
    {
      "id": "G10",
      "category": "scope-judgment",
      "summary": "Plan is ambiguous or contradictory on a decision that changes what gets built.",
      "severity": false
    },
    {
      "id": "G11",
      "category": "scope-judgment",
      "summary": "Work grew beyond claimed scope (>2× estimate or undeclared Tier C surface).",
      "severity": false
    },
    {
      "id": "G12",
      "category": "scope-judgment",
      "summary": "Tier C review floor (D-015): E3 at the exact head + required checks.",
      "severity": false,
      "relatedTierIds": [
        "C"
      ]
    },
    {
      "id": "G13",
      "category": "scope-judgment",
      "summary": "Two agents want conflicting approaches and coordination failed.",
      "severity": false
    },
    {
      "id": "G14",
      "category": "access-security",
      "summary": "Credentials or approvals only a human holds.",
      "severity": false
    },
    {
      "id": "G15",
      "category": "access-security",
      "summary": "Active exploitation signal or vulnerability discovered live in production.",
      "severity": true
    },
    {
      "id": "G16",
      "category": "access-security",
      "summary": "Evidence of prompt-injection steering an agent.",
      "severity": true
    }
  ],
  "riskTiers": [
    {
      "id": "A",
      "definition": "Routine: UI copy, isolated components, docs, tests.",
      "evidenceMinimums": {
        "reviewDepth": "solo",
        "adversarialReview": false,
        "humanMergeGate": false,
        "crossVendorPreferred": true
      }
    },
    {
      "id": "B",
      "definition": "Elevated: shared modules, API routes, data reads, >150 lines or >6 files.",
      "evidenceMinimums": {
        "reviewDepth": "full-lens",
        "adversarialReview": false,
        "humanMergeGate": false,
        "uxEvalIfVisible": true,
        "crossVendorPreferred": true
      }
    },
    {
      "id": "C",
      "definition": "Money, auth, consent/PII, security boundaries, schema, incident alerting, prod data.",
      "evidenceMinimums": {
        "reviewDepth": "fan-out",
        "adversarialReview": true,
        "humanMergeGate": true,
        "humanGateIds": [
          "G12"
        ],
        "uxEvalIfVisible": true,
        "serializedWhenStateful": true,
        "crossVendorPreferred": true
      }
    }
  ],
  "roles": [
    {
      "id": "planner",
      "summary": "Expand a brief into PLAN.md with testable acceptance criteria."
    },
    {
      "id": "decomposer",
      "summary": "Turn an approved plan into dependency-ordered contract-bearing issues."
    },
    {
      "id": "builder",
      "summary": "Claim one issue, implement in a worktree, open a green-gate PR."
    },
    {
      "id": "test-engineer",
      "summary": "Attach executable checks for every contract criterion."
    },
    {
      "id": "reviewer",
      "summary": "Multi-lens review with APPROVE or REQUEST_CHANGES; never own generation."
    },
    {
      "id": "ux-evaluator",
      "summary": "Grade live preview against design language; never evaluate from the diff alone."
    },
    {
      "id": "security",
      "summary": "Run security layers; adversarial pass on Tier C; no report-only softening of hard-fail."
    },
    {
      "id": "release",
      "summary": "Merge approved green work, verify deploy, clean claim; never rotate secrets."
    },
    {
      "id": "historian",
      "summary": "File lessons and harness improvements from exhaust; append, do not rewrite history."
    }
  ],
  "forbiddenRolePairs": [
    {
      "a": "builder",
      "b": "reviewer",
      "scope": "same-unit-of-work",
      "symmetric": true,
      "rationale": "Law 5 / docs/03: builder ≠ reviewer on the same unit of work."
    },
    {
      "a": "builder",
      "b": "ux-evaluator",
      "scope": "same-unit-of-work",
      "symmetric": true,
      "rationale": "Law 5 / docs/03: builder ≠ ux-evaluator on the same unit of work."
    },
    {
      "a": "reviewer",
      "b": "ux-evaluator",
      "scope": "same-unit-of-work",
      "symmetric": true,
      "rationale": "docs/03 separation: builder ≠ reviewer ≠ ux-evaluator on the same unit of work."
    }
  ],
  "reviewIndependence": [
    {
      "id": "ri.law5",
      "description": "Never grade your own homework. Generator must not equal reviewer on the same unit.",
      "minimumRelationship": "different-agent",
      "preferredRelationship": "cross-vendor",
      "generatorMustNotEqual": "reviewer"
    },
    {
      "id": "ri.tier-a",
      "description": "Tier A: solo review pass; standard gates.",
      "tierId": "A",
      "minimumRelationship": "independent-approve",
      "preferredRelationship": "cross-vendor"
    },
    {
      "id": "ri.tier-b",
      "description": "Tier B: full-lens independent APPROVE; prefer two fresh-context verdicts in solo-platform mode.",
      "tierId": "B",
      "minimumRelationship": "independent-approve",
      "preferredRelationship": "two-fresh-context-approve"
    },
    {
      "id": "ri.tier-c",
      "description": "Tier C review floor (D-015): E3 at the exact head + required checks.",
      "tierId": "C",
      "minimumRelationship": "cross-vendor",
      "preferredRelationship": "cross-vendor",
      "humanGateId": "G12"
    }
  ],
  "workflowStages": [
    {
      "id": "plan",
      "order": 0,
      "name": "PLAN",
      "roleId": "planner"
    },
    {
      "id": "decompose",
      "order": 1,
      "name": "DECOMPOSE",
      "roleId": "decomposer"
    },
    {
      "id": "build",
      "order": 2,
      "name": "BUILD",
      "roleId": "builder"
    },
    {
      "id": "test",
      "order": 3,
      "name": "TEST",